mysql> use student;
Database changed
mysql> select * from employee;
+------+--------+--------+-----------+-------------+------------+-----------+
| id   | name   | salary | adress    | father_name | experience | dept      |
+------+--------+--------+-----------+-------------+------------+-----------+
|  523 | santhi | 100000 | mumbai    | raghu       |          4 | developer |
|  524 | ramya  | 150000 | chennai   | ramesh      |          3 | tester    |
|  525 | swathi | 130000 | delhi     | suresh      |          5 | developer |
|  526 | durga  | 170000 | hyderabad | rushi       |          3 | manager   |
+------+--------+--------+-----------+-------------+------------+-----------+
4 rows in set (0.00 sec)

mysql> update employee set salary=120000 where salary=100000;
Query OK, 1 row affected (0.02 sec)
Rows matched: 1  Changed: 1  Warnings: 0

mysql> select * from employee;
+------+--------+--------+-----------+-------------+------------+-----------+
| id   | name   | salary | adress    | father_name | experience | dept      |
+------+--------+--------+-----------+-------------+------------+-----------+
|  523 | santhi | 120000 | mumbai    | raghu       |          4 | developer |
|  524 | ramya  | 150000 | chennai   | ramesh      |          3 | tester    |
|  525 | swathi | 130000 | delhi     | suresh      |          5 | developer |
|  526 | durga  | 170000 | hyderabad | rushi       |          3 | manager   |
+------+--------+--------+-----------+-------------+------------+-----------+
4 rows in set (0.00 sec)
mysql> select * from empdep;
Empty set (0.01 sec)

mysql> select * from employee1;
+--------+--------+-------------+--------+---------------+
| emplid | name   | father_name | adress | father_adress |
+--------+--------+-------------+--------+---------------+
|    523 | santhi | raghu       | mumbai | guntur        |
|    526 | prema  | ramesh      | delhi  | ongole        |
+--------+--------+-------------+--------+---------------+
2 rows in set (0.00 sec)

mysql> select sum(saLary),min(salary),max(salary),avg(salary)from employee;
+-------------+-------------+-------------+-------------+
| sum(saLary) | min(salary) | max(salary) | avg(salary) |
+-------------+-------------+-------------+-------------+
|      570000 |      120000 |      170000 | 142500.0000 |
+-------------+-------------+-------------+-------------+
1 row in set (0.02 sec)
mysql> select name,salary from employee where experience=4;
+--------+--------+
| name   | salary |
+--------+--------+
| santhi | 120000 |
+--------+--------+
1 row in set (0.01 sec)

mysql> delete from employee1 where father_adress='guntur';
Query OK, 1 row affected (0.00 sec)

mysql> select * from employee1;
+--------+-------+-------------+--------+---------------+
| emplid | name  | father_name | adress | father_adress |
+--------+-------+-------------+--------+---------------+
|    526 | prema | ramesh      | delhi  | ongole        |
+--------+-------+-------------+--------+---------------+
1 row in set (0.00 sec)

mysql>
